[
  {
    "question_id": "Q-GI-001",
    "canonical_question": "What is the maximum investment limit in Public Provident Fund (PPF) in a financial year?",
    "normalized_question": "What is the maximum annual deposit limit in a PPF account?",
    "alternate_phrasings": [
      "PPF me ek saal me kitna paisa jama kar sakte hain?",
      "Can I deposit more than 1.5 lakh in PPF?",
      "PPF maximum deposit limit per year"
    ],
    "category": "Government Investments",
    "subcategory": "Public Provident Fund (PPF)",
    "search_intent": "informational",
    "audience": "citizens",
    "geography": "India (All)",
    "language": "en",
    "evidence_status": "DIRECTLY_OBSERVED",
    "observed_on_google": true,
    "source_type": "google_search_observed",
    "source_urls": [
      "https://www.hdfcbank.com/personal/resources/learning-centre/save/ppf-rules-and-regulations"
    ],
    "answer_status": "UNANSWERED",
    "verification_status": "GOV_VERIFIED",
    "last_verified_at": "2026-10-09",
    "suggested_existing_page": "/investments/public-provident-fund",
    "related_question_ids": [
      "Q-GI-002",
      "Q-GI-004",
      "Q-CMP-001",
      "Q-CALC-001"
    ],
    "relationships": {
      "broader_question": null,
      "narrower_questions": [
        "Q-GI-002",
        "Q-GI-004"
      ],
      "comparison_questions": [
        "Q-CMP-001"
      ],
      "eligibility_question": "Q-GI-003",
      "application_question": null,
      "document_requirement_question": null,
      "status_tracking_question": null,
      "deadline_question": null,
      "related_calculator": "/tools",
      "related_official_source": "https://www.indiapost.gov.in"
    },
    "duplicate_of": null,
    "review_required": false,
    "priority": "CRITICAL",
    "record_created_at": "2026-10-09T05:40:00.000Z",
    "record_updated_at": "2026-10-09T05:45:00.000Z"
  },
  {
    "question_id": "Q-GI-002",
    "canonical_question": "Why should PPF deposits be made on or before the 5th of every month?",
    "normalized_question": "How is monthly interest calculated on PPF account balance?",
    "alternate_phrasings": [
      "PPF interest calculation 5th of month rule",
      "PPF me interest kab calculate hota hai?",
      "Best date to deposit money in PPF"
    ],
    "category": "Government Investments",
    "subcategory": "Public Provident Fund (PPF)",
    "search_intent": "calculation",
    "audience": "investors",
    "geography": "India (All)",
    "language": "en",
    "evidence_status": "OFFICIAL_SOURCE_VERIFIED",
    "observed_on_google": false,
    "source_type": "official_gov_faq",
    "source_urls": [
      "https://www.sbi.co.in/web/personal-banking/investments-deposits/govt-schemes/ppf"
    ],
    "answer_status": "UNANSWERED",
    "verification_status": "GOV_VERIFIED",
    "last_verified_at": "2026-10-09",
    "suggested_existing_page": "/investments/public-provident-fund",
    "related_question_ids": [
      "Q-GI-001",
      "Q-CALC-001"
    ],
    "relationships": {
      "broader_question": "Q-GI-001",
      "narrower_questions": [],
      "comparison_questions": [],
      "eligibility_question": null,
      "application_question": null,
      "document_requirement_question": null,
      "status_tracking_question": null,
      "deadline_question": null,
      "related_calculator": "/tools",
      "related_official_source": "https://www.sbi.co.in"
    },
    "duplicate_of": null,
    "review_required": false,
    "priority": "CRITICAL",
    "record_created_at": "2026-10-09T05:40:00.000Z",
    "record_updated_at": "2026-10-09T05:45:00.000Z"
  },
  {
    "question_id": "Q-GI-003",
    "canonical_question": "Can an NRI continue an existing PPF account after moving abroad?",
    "normalized_question": "Can Non-Resident Indians (NRIs) hold or extend a PPF account?",
    "alternate_phrasings": [
      "NRI PPF account rules",
      "Can NRI extend PPF after 15 years?",
      "NRI banne ke baad PPF account ka kya hota hai?"
    ],
    "category": "Government Investments",
    "subcategory": "Public Provident Fund (PPF)",
    "search_intent": "eligibility_check",
    "audience": "citizens",
    "geography": "India (All)",
    "language": "en",
    "evidence_status": "DIRECTLY_OBSERVED",
    "observed_on_google": true,
    "source_type": "google_search_observed",
    "source_urls": [
      "https://www.etmoney.com/learn/ppf/ppf-rules/"
    ],
    "answer_status": "UNANSWERED",
    "verification_status": "GOV_VERIFIED",
    "last_verified_at": "2026-10-09",
    "suggested_existing_page": "/investments/public-provident-fund",
    "related_question_ids": [
      "Q-GI-001",
      "Q-GI-004"
    ],
    "relationships": {
      "broader_question": "Q-GI-001",
      "narrower_questions": [],
      "comparison_questions": [],
      "eligibility_question": null,
      "application_question": null,
      "document_requirement_question": null,
      "status_tracking_question": null,
      "deadline_question": null,
      "related_calculator": null,
      "related_official_source": "https://www.rbi.org.in"
    },
    "duplicate_of": null,
    "review_required": false,
    "priority": "HIGH",
    "record_created_at": "2026-10-09T05:40:00.000Z",
    "record_updated_at": "2026-10-09T05:45:00.000Z"
  },
  {
    "question_id": "Q-GI-004",
    "canonical_question": "What is the premature withdrawal penalty and rule for PPF accounts after 5 years?",
    "normalized_question": "Under what conditions can a PPF account be prematurely closed or withdrawn?",
    "alternate_phrasings": [
      "PPF se 5 saal baad kitna paisa nikal sakte hain?",
      "PPF premature closure grounds and penalty",
      "Partial withdrawal limit in PPF"
    ],
    "category": "Government Investments",
    "subcategory": "Public Provident Fund (PPF)",
    "search_intent": "transactional",
    "audience": "citizens",
    "geography": "India (All)",
    "language": "en",
    "evidence_status": "DIRECTLY_OBSERVED",
    "observed_on_google": true,
    "source_type": "google_search_observed",
    "source_urls": [
      "https://www.valueresearchonline.com/stories/52431/ppf-premature-closure-rules/"
    ],
    "answer_status": "UNANSWERED",
    "verification_status": "GOV_VERIFIED",
    "last_verified_at": "2026-10-09",
    "suggested_existing_page": "/investments/public-provident-fund",
    "related_question_ids": [
      "Q-GI-001",
      "Q-GI-002"
    ],
    "relationships": {
      "broader_question": "Q-GI-001",
      "narrower_questions": [],
      "comparison_questions": [],
      "eligibility_question": null,
      "application_question": null,
      "document_requirement_question": null,
      "status_tracking_question": null,
      "deadline_question": null,
      "related_calculator": "/tools",
      "related_official_source": "https://nsiindia.gov.in"
    },
    "duplicate_of": null,
    "review_required": false,
    "priority": "HIGH",
    "record_created_at": "2026-10-09T05:40:00.000Z",
    "record_updated_at": "2026-10-09T05:45:00.000Z"
  },
  {
    "question_id": "Q-GI-005",
    "canonical_question": "What is the maximum age limit of a girl child to open a Sukanya Samriddhi Yojana (SSY) account?",
    "normalized_question": "What is the age criteria for opening a Sukanya Samriddhi Account?",
    "alternate_phrasings": [
      "Sukanya Samriddhi me ladki ki age kitni honi chahiye?",
      "Can I open SSY account for 11 year old daughter?",
      "SSY entry age limit"
    ],
    "category": "Government Investments",
    "subcategory": "Sukanya Samriddhi Yojana (SSY)",
    "search_intent": "eligibility_check",
    "audience": "citizens",
    "geography": "India (All)",
    "language": "en",
    "evidence_status": "OFFICIAL_SOURCE_VERIFIED",
    "observed_on_google": false,
    "source_type": "official_gov_faq",
    "source_urls": [
      "https://www.myscheme.gov.in/schemes/ssy"
    ],
    "answer_status": "UNANSWERED",
    "verification_status": "GOV_VERIFIED",
    "last_verified_at": "2026-10-09",
    "suggested_existing_page": "/investments/sukanya-samriddhi-yojana",
    "related_question_ids": [
      "Q-GI-006",
      "Q-GI-007",
      "Q-CMP-001",
      "Q-CALC-002"
    ],
    "relationships": {
      "broader_question": null,
      "narrower_questions": [
        "Q-GI-006",
        "Q-GI-007"
      ],
      "comparison_questions": [
        "Q-CMP-001"
      ],
      "eligibility_question": null,
      "application_question": null,
      "document_requirement_question": null,
      "status_tracking_question": null,
      "deadline_question": null,
      "related_calculator": "/tools",
      "related_official_source": "https://www.myscheme.gov.in"
    },
    "duplicate_of": null,
    "review_required": false,
    "priority": "CRITICAL",
    "record_created_at": "2026-10-09T05:40:00.000Z",
    "record_updated_at": "2026-10-09T05:45:00.000Z"
  },
  {
    "question_id": "Q-GI-006",
    "canonical_question": "How many Sukanya Samriddhi accounts can be opened in one family?",
    "normalized_question": "What is the account limit for Sukanya Samriddhi Yojana per household?",
    "alternate_phrasings": [
      "Can twins have 3 SSY accounts?",
      "Kya 3 betiyon ke liye Sukanya account khul sakta hai?",
      "SSY rules for twins and triplets"
    ],
    "category": "Government Investments",
    "subcategory": "Sukanya Samriddhi Yojana (SSY)",
    "search_intent": "eligibility_check",
    "audience": "citizens",
    "geography": "India (All)",
    "language": "en",
    "evidence_status": "OFFICIAL_SOURCE_VERIFIED",
    "observed_on_google": false,
    "source_type": "official_gov_faq",
    "source_urls": [
      "https://nsiindia.gov.in"
    ],
    "answer_status": "UNANSWERED",
    "verification_status": "GOV_VERIFIED",
    "last_verified_at": "2026-10-09",
    "suggested_existing_page": "/investments/sukanya-samriddhi-yojana",
    "related_question_ids": [
      "Q-GI-005",
      "Q-GI-007"
    ],
    "relationships": {